{
  "schema_version": 1,
  "owner": "kmadhok",
  "updated_at": "2026-07-20T14:29:07Z",
  "projects": [
    {
      "id": "github:kmadhok/advancedcompvisionproject",
      "name": "AdvancedCompVisionProject",
      "repository": "kmadhok/AdvancedCompVisionProject",
      "review_status": "needs_review",
      "purpose": null,
      "public_summary": null,
      "lifecycle": null,
      "active": false,
      "priority": null,
      "desired_outcome": null,
      "next_action": null,
      "last_reviewed_at": null,
      "accomplishments": [],
      "relationships": [],
      "tags": [],
      "understanding_path": null,
      "notes": null
    },
    {
      "id": "github:kmadhok/agent_trading",
      "name": "Agent_Trading",
      "repository": "kmadhok/Agent_Trading",
      "review_status": "needs_review",
      "purpose": null,
      "public_summary": null,
      "lifecycle": null,
      "active": false,
      "priority": null,
      "desired_outcome": null,
      "next_action": null,
      "last_reviewed_at": null,
      "accomplishments": [],
      "relationships": [],
      "tags": [],
      "understanding_path": null,
      "notes": null
    },
    {
      "id": "github:kmadhok/ai-news-aggregator",
      "name": "AI-News-Aggregator",
      "repository": "kmadhok/AI-News-Aggregator",
      "review_status": "needs_review",
      "purpose": "Aggregate AI news and research from multiple sources into local Markdown, then organize, index, search, and explore it through semantic and topic-graph workflows.",
      "public_summary": null,
      "lifecycle": null,
      "active": false,
      "priority": null,
      "desired_outcome": null,
      "next_action": null,
      "last_reviewed_at": null,
      "accomplishments": [],
      "relationships": [],
      "tags": [
        "ai",
        "content-intelligence",
        "knowledge-graph"
      ],
      "understanding_path": "data/understanding/kmadhok__AI-News-Aggregator.json",
      "notes": null
    },
    {
      "id": "github:kmadhok/algotradeframework",
      "name": "AlgoTradeFramework",
      "repository": "kmadhok/AlgoTradeFramework",
      "review_status": "needs_review",
      "purpose": null,
      "public_summary": null,
      "lifecycle": "reference",
      "active": false,
      "priority": null,
      "desired_outcome": null,
      "next_action": null,
      "last_reviewed_at": null,
      "accomplishments": [],
      "relationships": [],
      "tags": [],
      "understanding_path": null,
      "notes": null
    },
    {
      "id": "github:kmadhok/amazon-a2i-sample-jupyter-notebooks",
      "name": "amazon-a2i-sample-jupyter-notebooks",
      "repository": "kmadhok/amazon-a2i-sample-jupyter-notebooks",
      "review_status": "needs_review",
      "purpose": null,
      "public_summary": null,
      "lifecycle": "reference",
      "active": false,
      "priority": null,
      "desired_outcome": null,
      "next_action": null,
      "last_reviewed_at": null,
      "accomplishments": [],
      "relationships": [],
      "tags": [],
      "understanding_path": null,
      "notes": null
    },
    {
      "id": "github:kmadhok/article_extraction",
      "name": "Article_Extraction",
      "repository": "kmadhok/Article_Extraction",
      "review_status": "needs_review",
      "purpose": null,
      "public_summary": null,
      "lifecycle": null,
      "active": false,
      "priority": null,
      "desired_outcome": null,
      "next_action": null,
      "last_reviewed_at": null,
      "accomplishments": [],
      "relationships": [],
      "tags": [],
      "understanding_path": null,
      "notes": null
    },
    {
      "id": "github:kmadhok/automate_job_search",
      "name": "Automate_Job_Search",
      "repository": "kmadhok/Automate_Job_Search",
      "review_status": "needs_review",
      "purpose": null,
      "public_summary": null,
      "lifecycle": null,
      "active": false,
      "priority": null,
      "desired_outcome": null,
      "next_action": null,
      "last_reviewed_at": null,
      "accomplishments": [],
      "relationships": [],
      "tags": [],
      "understanding_path": null,
      "notes": null
    },
    {
      "id": "github:kmadhok/autonomous-data-analyst",
      "name": "Autonomous-Data-Analyst",
      "repository": "kmadhok/Autonomous-Data-Analyst",
      "review_status": "needs_review",
      "purpose": null,
      "public_summary": null,
      "lifecycle": null,
      "active": false,
      "priority": null,
      "desired_outcome": null,
      "next_action": null,
      "last_reviewed_at": null,
      "accomplishments": [],
      "relationships": [],
      "tags": [],
      "understanding_path": null,
      "notes": null
    },
    {
      "id": "github:kmadhok/autonomous-semantic-layer",
      "name": "Autonomous-Semantic-Layer",
      "repository": "kmadhok/Autonomous-Semantic-Layer",
      "review_status": "needs_review",
      "purpose": null,
      "public_summary": null,
      "lifecycle": null,
      "active": false,
      "priority": null,
      "desired_outcome": null,
      "next_action": null,
      "last_reviewed_at": null,
      "accomplishments": [],
      "relationships": [],
      "tags": [],
      "understanding_path": null,
      "notes": null
    },
    {
      "id": "github:kmadhok/autoresearch",
      "name": "AutoResearch",
      "repository": "kmadhok/AutoResearch",
      "review_status": "needs_review",
      "purpose": "Run a bounded autonomous improvement loop in which Codex edits one scraper, evaluates results, and keeps or discards each change according to an objective score.",
      "public_summary": null,
      "lifecycle": null,
      "active": false,
      "priority": null,
      "desired_outcome": null,
      "next_action": null,
      "last_reviewed_at": null,
      "accomplishments": [],
      "relationships": [],
      "tags": [
        "autonomous-agents",
        "experimentation",
        "scraping"
      ],
      "understanding_path": "data/understanding/kmadhok__AutoResearch.json",
      "notes": null
    },
    {
      "id": "github:kmadhok/bank-loan-acceptance",
      "name": "Bank-Loan-Acceptance",
      "repository": "kmadhok/Bank-Loan-Acceptance",
      "review_status": "needs_review",
      "purpose": null,
      "public_summary": null,
      "lifecycle": "reference",
      "active": false,
      "priority": null,
      "desired_outcome": null,
      "next_action": null,
      "last_reviewed_at": null,
      "accomplishments": [],
      "relationships": [],
      "tags": [],
      "understanding_path": null,
      "notes": null
    },
    {
      "id": "github:kmadhok/brainrot",
      "name": "Brainrot",
      "repository": "kmadhok/Brainrot",
      "review_status": "needs_review",
      "purpose": null,
      "public_summary": null,
      "lifecycle": null,
      "active": false,
      "priority": null,
      "desired_outcome": null,
      "next_action": null,
      "last_reviewed_at": null,
      "accomplishments": [],
      "relationships": [],
      "tags": [],
      "understanding_path": null,
      "notes": null
    },
    {
      "id": "github:kmadhok/capstonerag",
      "name": "CapstoneRag",
      "repository": "kmadhok/CapstoneRag",
      "review_status": "needs_review",
      "purpose": null,
      "public_summary": null,
      "lifecycle": null,
      "active": false,
      "priority": null,
      "desired_outcome": null,
      "next_action": null,
      "last_reviewed_at": null,
      "accomplishments": [],
      "relationships": [],
      "tags": [],
      "understanding_path": null,
      "notes": null
    },
    {
      "id": "github:kmadhok/capstonerepo",
      "name": "CapstoneRepo",
      "repository": "kmadhok/CapstoneRepo",
      "review_status": "needs_review",
      "purpose": null,
      "public_summary": null,
      "lifecycle": null,
      "active": false,
      "priority": null,
      "desired_outcome": null,
      "next_action": null,
      "last_reviewed_at": null,
      "accomplishments": [],
      "relationships": [],
      "tags": [],
      "understanding_path": null,
      "notes": null
    },
    {
      "id": "github:kmadhok/chicago-crime-data-analysis",
      "name": "Chicago-Crime-Data-Analysis",
      "repository": "kmadhok/Chicago-Crime-Data-Analysis",
      "review_status": "needs_review",
      "purpose": null,
      "public_summary": null,
      "lifecycle": null,
      "active": false,
      "priority": null,
      "desired_outcome": null,
      "next_action": null,
      "last_reviewed_at": null,
      "accomplishments": [],
      "relationships": [],
      "tags": [],
      "understanding_path": null,
      "notes": null
    },
    {
      "id": "github:kmadhok/chicagofoodsafety",
      "name": "ChicagoFoodSafety",
      "repository": "kmadhok/ChicagoFoodSafety",
      "review_status": "needs_review",
      "purpose": null,
      "public_summary": null,
      "lifecycle": null,
      "active": false,
      "priority": null,
      "desired_outcome": null,
      "next_action": null,
      "last_reviewed_at": null,
      "accomplishments": [],
      "relationships": [],
      "tags": [],
      "understanding_path": null,
      "notes": null
    },
    {
      "id": "github:kmadhok/codingfun",
      "name": "CodingFun",
      "repository": "kmadhok/CodingFun",
      "review_status": "needs_review",
      "purpose": null,
      "public_summary": null,
      "lifecycle": null,
      "active": false,
      "priority": null,
      "desired_outcome": null,
      "next_action": null,
      "last_reviewed_at": null,
      "accomplishments": [],
      "relationships": [],
      "tags": [],
      "understanding_path": null,
      "notes": null
    },
    {
      "id": "github:kmadhok/commoncrawlexploration",
      "name": "CommonCrawlExploration",
      "repository": "kmadhok/CommonCrawlExploration",
      "review_status": "needs_review",
      "purpose": null,
      "public_summary": null,
      "lifecycle": null,